<?xml version="1.0" encoding="UTF-8" standalone="no"?>
<QUESTOR passion="Astendar" lang="de" rulesetversion="ED4" xmlns="http://earthdawn.com/discipline" xmlns:xsi="http://www.w3.org/2001/XMLSchema-instance" xmlns:edt="http://earthdawn.com/datatypes" xsi:schemaLocation="http://earthdawn.com/discipline ../../earthdawnquestor.xsd">
	<DEVOTION name="Questor" limitation="Astendar"/>
	<TIER>
		<OPTIONALDEVOTION name="Beeindrucken"/>
		<OPTIONALDEVOTION name="Bildende Kunst"/>
		<OPTIONALDEVOTION name="Empathische Wahrnehmung"/>
		<OPTIONALDEVOTION name="Erster Eindruck"/>
		<OPTIONALDEVOTION name="Gefühlsmelodie"/>
		<OPTIONALDEVOTION name="Gewinnendes Lächeln"/>
		<OPTIONALDEVOTION name="Konversation"/>
		<OPTIONALDEVOTION name="Schauspielern"/>
		<OPTIONALDEVOTION name="Stärkung der Passion"/>
		<OPTIONALDEVOTION name="Unterhalten"/>
		<RANK><!-- 1 -->
			<DEVOTIONABILITY/>
			<DEVOTIONDICESTEP count="3"/>
			<DEVOTIONBENEFIT spend="tbd by questor"/>
		</RANK>
		<RANK><!-- 2 -->
			<DEVOTIONABILITY/>
		</RANK>
		<RANK><!-- 3 -->
			<DEVOTIONABILITY/>
			<DEFENSE kind="social"/>
		</RANK>
		<RANK><!-- 4 -->
			<DEVOTIONABILITY/>
		</RANK>
	</TIER>
	<TIER>
		<OPTIONALDEVOTION name="Absichten Einschätzen"/>
		<OPTIONALDEVOTION name="Astendars Muse"/>
		<OPTIONALDEVOTION name="Astendars Stimme"/>
		<OPTIONALDEVOTION name="Bleibender Eindruck"/>
		<OPTIONALDEVOTION name="Diplomatie"/>
		<OPTIONALDEVOTION name="Einsicht der Passion"/>
		<OPTIONALDEVOTION name="Inspiration der Passion"/>
		<OPTIONALDEVOTION name="Verzaubertes Geschenk"/>
		<RANK><!-- 5 -->
			<DEVOTIONABILITY/>
			<DEVOTIONDICESTEP/>
			<DEVOTIONBENEFIT spend="tbd by player+gamemaster"/>
		</RANK>
		<RANK><!-- 6 -->
			<DEVOTIONABILITY/>
			<DEFENSE kind="social"/>
		</RANK>
		<RANK><!-- 7 -->
			<DEVOTIONABILITY/>
			<ARMOR name="additional questor armor" mysticarmor="1" weight="0"/>
		</RANK>
		<RANK><!-- 8 -->
			<DEVOTIONABILITY/>
			<DEFENSE kind="mystic"/>
		</RANK>
	</TIER>
	<TIER>
		<OPTIONALDEVOTION name="Bardenstimme"/>
		<OPTIONALDEVOTION name="Einfluss Beenden"/>
		<OPTIONALDEVOTION name="Entwaffnendes Lächeln"/>
		<OPTIONALDEVOTION name="Erwachende Liebe"/>
		<OPTIONALDEVOTION name="Fruchtbare Zeiten"/>
		<OPTIONALDEVOTION name="Gedankenkette"/>
		<RANK><!-- 9 -->
			<DEVOTIONABILITY/>
			<DEVOTIONDICESTEP/>
			<DEVOTIONBENEFIT spend="tbd by player+gamemaster"/>
		</RANK>
		<RANK><!-- 10 -->
			<DEVOTIONABILITY/>
			<DEFENSE kind="social"/>
		</RANK>
		<RANK><!-- 11 -->
			<DEVOTIONABILITY/>
			<RECOVERYTESTPERDAY/>
		</RANK>
		<RANK><!-- 12 -->
			<DEVOTIONABILITY/>
			<DEFENSE kind="mystic"/>
			<ARMOR name="additional questor armor" mysticarmor="1" weight="0"/>
		</RANK>
	</TIER>
	<IDEAL>Liebe</IDEAL>
	<IDEAL>Kunst</IDEAL>
	<IDEAL>Musik</IDEAL>
	<!-- Der Questor kann einen Weihepunkt ausgeben für ... .-->
	<DEVOTIONBENEFITEXAMPLE>eine Interaktionsprobe</DEVOTIONBENEFITEXAMPLE>
	<DEVOTIONBENEFITEXAMPLE>eine Probe, um Kunst zu erschaffen, sei es bildende Kunst, eine Vorführung o.Ä.</DEVOTIONBENEFITEXAMPLE>
	<DEVOTIONBENEFITEXAMPLE>eine Probe, wenn es darum geht, eine Romanze in Gang zu bringen oder zu fördern</DEVOTIONBENEFITEXAMPLE>
	<DEVOTIONBENEFITEXAMPLE>eine Probe, um den romantischen Partner des handelnden Charakters zu schützen</DEVOTIONBENEFITEXAMPLE>
	<DEVOTIONBENEFITEXAMPLE>eine Probe, um mehr über Kunst zu erfahren</DEVOTIONBENEFITEXAMPLE>
</QUESTOR>
