<?xml version="1.0" encoding="UTF-8" standalone="no"?>
<QUESTOR passion="Dis" lang="de" rulesetversion="ED4" xmlns="http://earthdawn.com/discipline" xmlns:xsi="http://www.w3.org/2001/XMLSchema-instance" xmlns:edt="http://earthdawn.com/datatypes" xsi:schemaLocation="http://earthdawn.com/discipline ../../earthdawnquestor.xsd">
	<DEVOTION name="Questor" limitation="Dis"/>
	<TIER>
		<OPTIONALDEVOTION name="Detailorientierung"/>
		<OPTIONALDEVOTION name="Einfluss Widerstehen"/>
		<OPTIONALDEVOTION name="Einsicht der Passion"/>
		<OPTIONALDEVOTION name="Eiserner Wille"/>
		<OPTIONALDEVOTION name="Etikette"/>
		<OPTIONALDEVOTION name="Forschen"/>
		<OPTIONALDEVOTION name="Konversation"/>
		<OPTIONALDEVOTION name="Projektmanagement"/>
		<OPTIONALDEVOTION name="Stärkung der Passion"/>
		<OPTIONALDEVOTION name="Verängstigen"/>
		<RANK><!-- 1 -->
			<DEVOTIONABILITY/>
			<DEVOTIONDICESTEP count="3"/>
			<DEVOTIONBENEFIT spend="tbd by questor"/>
		</RANK>
		<RANK><!-- 2 -->
			<DEVOTIONABILITY/>
		</RANK>
		<RANK><!-- 3 -->
			<DEVOTIONABILITY/>
			<DEFENSE kind="mystic"/>
		</RANK>
		<RANK><!-- 4 -->
			<DEVOTIONABILITY/>
		</RANK>
	</TIER>
	<TIER>
		<OPTIONALDEVOTION name="Einfluss Beenden"/>
		<OPTIONALDEVOTION name="Führung"/>
		<OPTIONALDEVOTION name="Inspiration der Passion"/>
		<OPTIONALDEVOTION name="Lebender Tod"/>
		<OPTIONALDEVOTION name="Stählerner Blick"/>
		<OPTIONALDEVOTION name="Starrsinn"/>
		<OPTIONALDEVOTION name="Trostlosigkeit"/>
		<OPTIONALDEVOTION name="Vergifteter Einfluss"/>
		<RANK><!-- 5 -->
			<DEVOTIONABILITY/>
			<DEVOTIONDICESTEP/>
			<DEVOTIONBENEFIT spend="tbd by player+gamemaster"/>
		</RANK>
		<RANK><!-- 6 -->
			<DEVOTIONABILITY/>
			<DEFENSE kind="mystic"/>
		</RANK>
		<RANK><!-- 7 -->
			<DEVOTIONABILITY/>
			<ARMOR name="additional questor armor" mysticarmor="1" weight="0"/>
		</RANK>
		<RANK><!-- 8 -->
			<DEVOTIONABILITY/>
			<DEFENSE kind="social"/>
		</RANK>
	</TIER>
	<TIER>
		<OPTIONALDEVOTION name="Dis' Herausforderung"/>
		<OPTIONALDEVOTION name="Ketten des Gehorsams"/>
		<OPTIONALDEVOTION name="Untergraben"/>
		<OPTIONALDEVOTION name="Unterwerfen"/>
		<OPTIONALDEVOTION name="Verzaubertes Geschenk"/>
		<OPTIONALDEVOTION name="Zwingen"/>
		<RANK><!-- 9 -->
			<DEVOTIONABILITY/>
			<DEVOTIONDICESTEP/>
			<DEVOTIONBENEFIT spend="tbd by player+gamemaster"/>
		</RANK>
		<RANK><!-- 10 -->
			<DEVOTIONABILITY/>
			<DEFENSE kind="mystic"/>
		</RANK>
		<RANK><!-- 11 -->
			<DEVOTIONABILITY/>
			<RECOVERYTESTPERDAY/>
		</RANK>
		<RANK><!-- 12 -->
			<DEVOTIONABILITY/>
			<DEFENSE kind="social"/>
			<ARMOR name="additional questor armor" mysticarmor="1" weight="0"/>
		</RANK>
	</TIER>
	<IDEAL>Verwirrung</IDEAL>
	<IDEAL>unnötige Arbeit</IDEAL>
	<IDEAL>komplexe bürokratische Hierarchien</IDEAL>
	<IDEAL>Sklaverei und Beherrschung</IDEAL>
	<!-- Der Questor kann einen Weihepunkt ausgeben für ... .-->
	<DEVOTIONBENEFITEXAMPLE>eine Interaktionsprobe</DEVOTIONBENEFITEXAMPLE>
	<DEVOTIONBENEFITEXAMPLE>eine Probe, um ein Ziel zu dominieren.</DEVOTIONBENEFITEXAMPLE>
	<DEVOTIONBENEFITEXAMPLE>eine Probe, wenn er mit der Bürokratie interagiert</DEVOTIONBENEFITEXAMPLE>
	<DEVOTIONBENEFITEXAMPLE>die Aktionsprobe eines Untergebenen</DEVOTIONBENEFITEXAMPLE>
	<DEVOTIONBENEFITEXAMPLE>eine Aufrechterhaltene Aktion eines anderen, aber die Vollendung dieser Aktion dauert doppelt so lange wie normal</DEVOTIONBENEFITEXAMPLE>
</QUESTOR>
